id,name,type,gender,category_id,parent_id
15872,"ITF Kazakhstan F2, Men Singles",singles,men,785,15980
15874,"ITF Kazakhstan F2, Men Doubles",doubles,men,785,15980
15876,"ITF Egypt F3, Men Singles",singles,men,785,15964
15878,"ITF Egypt F3, Men Doubles",doubles,men,785,15964
15950,"ITF Portugal F1, Men Doubles",doubles,men,785,16124
15990,"ITF Turkey F4, Men Singles",singles,men,785,15972
15992,"ITF USA F6, Men Singles",singles,men,785,15974
15994,"ITF Switzerland F1, Men Singles",singles,men,785,15886
15996,"ITF Egypt F4, Men Singles",singles,men,785,15888
15998,"ITF Great Britain F2, Men Singles",singles,men,785,15890
16000,"ITF Indonesia F1, Men Singles",singles,men,785,15892
16002,"ITF Spain F4, Men Doubles",doubles,men,785,15894
16004,"ITF Tunisia F5, Men Singles",singles,men,785,15898
16006,"ITF Turkey F5, Men Singles",singles,men,785,15900
16120,"ITF Egypt F7, Men Singles",singles,men,785,15946
16126,"ITF Tunisia F8, Men Singles",singles,men,785,15952
16128,"ITF Turkey F8, Men Singles",singles,men,785,15954
16144,"ITF Great Britain F1, Men Singles",singles,men,785,15984
16146,"ITF Great Britain F1, Men Doubles",doubles,men,785,15984
16150,"ITF China F13, Men Singles",singles,men,785,16148
16152,"ITF China F13, Men Doubles",doubles,men,785,16148
16156,"ITF Czech Republic F6, Men Singles",singles,men,785,16154
16158,"ITF Czech Republic F6, Men Doubles",doubles,men,785,16154
16162,"ITF Germany F8, Men Singles",singles,men,785,16160
16164,"ITF Germany F8, Men Doubles",doubles,men,785,16160
16168,"ITF Ireland F1, Men Singles",singles,men,785,16166
16170,"ITF Ireland F1, Men Doubles",doubles,men,785,16166
16174,"ITF Spain F22, Men Singles",singles,men,785,16172
16176,"ITF Spain F22, Men Doubles",doubles,men,785,16172
16180,"ITF Turkey F26, Men Singles",singles,men,785,16178
16182,"ITF Turkey F26, Men Doubles",doubles,men,785,16178
16186,"ITF USA F24, Men Singles",singles,men,785,16184
16188,"ITF USA F24, Men Doubles",doubles,men,785,16184
16192,"ITF Austria F3, Men Singles",singles,men,785,16190
16194,"ITF Austria F3, Men Doubles",doubles,men,785,16190
16198,"ITF Belgium F5, Men Singles",singles,men,785,16196
16200,"ITF Belgium F5, Men Doubles",doubles,men,785,16196
16204,"ITF Colombia F1, Men Singles",singles,men,785,16202
16206,"ITF Colombia F1, Men Doubles",doubles,men,785,16202
16210,"ITF Egypt F21, Men Singles",singles,men,785,16208
16212,"ITF Egypt F21, Men Doubles",doubles,men,785,16208
16216,"ITF France F16, Men Singles",singles,men,785,16214
16218,"ITF France F16, Men Doubles",doubles,men,785,16214
16222,"ITF Georgia F3, Men Singles",singles,men,785,16220
16224,"ITF Georgia F3, Men Doubles",doubles,men,785,16220
16228,"ITF Italy F22, Men Singles",singles,men,785,16226
16230,"ITF Italy F22, Men Doubles",doubles,men,785,16226
16234,"ITF Lithuania F1, Men Singles",singles,men,785,16232
16236,"ITF Lithuania F1, Men Doubles",doubles,men,785,16232
16240,"ITF Morocco F1, Men Singles",singles,men,785,16238
16242,"ITF Morocco F1, Men Doubles",doubles,men,785,16238
16246,"ITF Poland F6, Men Singles",singles,men,785,16244
16248,"ITF Poland F6, Men Doubles",doubles,men,785,16244
16252,"ITF Portugal F12, Men Singles",singles,men,785,16250
16254,"ITF Portugal F12, Men Doubles",doubles,men,785,16250
16256,"ITF Spain F3, Men Singles",singles,men,785,15986
16258,"ITF Spain F3, Men Doubles",doubles,men,785,15986
16260,"ITF Tunisia F4, Men Singles",singles,men,785,15970
16262,"ITF Tunisia F4, Men Doubles",doubles,men,785,15970
16266,"ITF Kazakhstan 05A, Women Singles",singles,women,213,16264
16268,"ITF Kazakhstan 05A, Women Doubles",doubles,women,213,16264
16272,"ITF Czech Republic 03A, Women Singles",singles,women,213,16270
16274,"ITF Czech Republic 03A, Women Doubles",doubles,women,213,16270
16278,"ITF Turkey 28A, Women Singles",singles,women,213,16276
16280,"ITF Turkey 28A, Women Doubles",doubles,women,213,16276
16284,"ITF USA 22A, Women Singles",singles,women,213,16282
16286,"ITF USA 22A, Women Doubles",doubles,women,213,16282
16290,"ITF Canada 05A, Women Singles",singles,women,213,16288
16292,"ITF Canada 05A, Women Doubles",doubles,women,213,16288
16296,"ITF China 14A, Women Singles",singles,women,213,16294
16298,"ITF China 14A, Women Doubles",doubles,women,213,16294
16302,"ITF Germany 10A, Women Singles",singles,women,213,16300
16304,"ITF Germany 10A, Women Doubles",doubles,women,213,16300
16308,"ITF Italy 19A, Women Singles",singles,women,213,16306
16310,"ITF Italy 19A, Women Doubles",doubles,women,213,16306
16314,"ITF Belgium 01A, Women Singles",singles,women,213,16312
16316,"ITF Belgium 01A, Women Doubles",doubles,women,213,16312
16320,"ITF Egypt 21A, Women Singles",singles,women,213,16318
16322,"ITF Egypt 21A, Women Doubles",doubles,women,213,16318
16326,"ITF Romania 05A, Women Singles",singles,women,213,16324
16328,"ITF Romania 05A, Women Doubles",doubles,women,213,16324
16332,"ITF Spain 11A, Women Singles",singles,women,213,16330
16334,"ITF Spain 11A, Women Doubles",doubles,women,213,16330
16338,"ITF Thailand 05A, Women Singles",singles,women,213,16336
16340,"ITF Thailand 05A, Women Doubles",doubles,women,213,16336
16454,"ITF China F14, Men Singles",singles,men,785,16416
16456,"ITF China F14, Men Doubles",doubles,men,785,16416
16458,"ITF France F17, Men Singles",singles,men,785,16418
16460,"ITF France F17, Men Doubles",doubles,men,785,16418
16462,"ITF Ireland F2, Men Singles",singles,men,785,16420
16464,"ITF Ireland F2, Men Doubles",doubles,men,785,16420
16466,"ITF Italy F23, Men Singles",singles,men,785,16422
16468,"ITF Italy F23, Men Doubles",doubles,men,785,16422
16470,"ITF Spain F23, Men Singles",singles,men,785,16424
16472,"ITF Spain F23, Men Doubles",doubles,men,785,16424
16474,"ITF USA F25, Men Singles",singles,men,785,16426
16476,"ITF USA F25, Men Doubles",doubles,men,785,16426
16478,"ITF Austria F4, Men Singles",singles,men,785,16428
16480,"ITF Austria F4, Men Doubles",doubles,men,785,16428
16482,"ITF Belgium F6, Men Singles",singles,men,785,16430
16484,"ITF Belgium F6, Men Doubles",doubles,men,785,16430
16486,"ITF Colombia F2, Men Singles",singles,men,785,16432
16488,"ITF Colombia F2, Men Doubles",doubles,men,785,16432
16490,"ITF Egypt F22, Men Singles",singles,men,785,16434
16492,"ITF Egypt F22, Men Doubles",doubles,men,785,16434
16494,"ITF Estonia F1, Men Singles",singles,men,785,16436
16496,"ITF Estonia F1, Men Doubles",doubles,men,785,16436
16498,"ITF Macedonia F1, Men Singles",singles,men,785,16438
16500,"ITF Macedonia F1, Men Doubles",doubles,men,785,16438
16502,"ITF Morocco F2, Men Singles",singles,men,785,16440
16504,"ITF Morocco F2, Men Doubles",doubles,men,785,16440
16506,"ITF Poland F7, Men Singles",singles,men,785,16442
16508,"ITF Poland F7, Men Doubles",doubles,men,785,16442
16510,"ITF Portugal F13, Men Singles",singles,men,785,16444
16512,"ITF Portugal F13, Men Doubles",doubles,men,785,16444
16514,"ITF Romania F7, Men Singles",singles,men,785,16446
16516,"ITF Romania F7, Men Doubles",doubles,men,785,16446
16518,"ITF Russia F4, Men Singles",singles,men,785,16448
16520,"ITF Russia F4, Men Doubles",doubles,men,785,16448
16522,"ITF Slovakia F1, Men Singles",singles,men,785,16450
16524,"ITF Slovakia F1, Men Doubles",doubles,men,785,16450
16526,"ITF Turkiye F27, Men Singles",singles,men,785,16452
16528,"ITF Turkiye F27, Men Doubles",doubles,men,785,16452
16566,"ITF Czechia 04A, Women Singles",singles,women,213,16536
16568,"ITF Czechia 04A, Women Doubles",doubles,women,213,16536
16570,"ITF Canada 06A, Women Singles",singles,women,213,16538
16572,"ITF Canada 06A, Women Doubles",doubles,women,213,16538
16574,"ITF USA 26A, Women Singles",singles,women,213,16540
16576,"ITF USA 26A, Women Doubles",doubles,women,213,16540
16578,"ITF Germany 11A, Women Singles",singles,women,213,16542
16580,"ITF Germany 11A, Women Doubles",doubles,women,213,16542
16582,"ITF Thailand 06A, Women Singles",singles,women,213,16544
16584,"ITF Thailand 06A, Women Doubles",doubles,women,213,16544
16586,"ITF Brazil 07A, Women Singles",singles,women,213,16546
16588,"ITF Brazil 07A, Women Doubles",doubles,women,213,16546
16590,"ITF Egypt 22A, Women Singles",singles,women,213,16548
16592,"ITF Egypt 22A, Women Doubles",doubles,women,213,16548
16594,"ITF Estonia 01A, Women Singles",singles,women,213,16550
16596,"ITF Estonia 01A, Women Doubles",doubles,women,213,16550
16598,"ITF Finland 01A, Women Singles",singles,women,213,16552
16600,"ITF Finland 01A, Women Doubles",doubles,women,213,16552
16602,"ITF France 20A, Women Singles",singles,women,213,16554
16604,"ITF France 20A, Women Doubles",doubles,women,213,16554
16610,"ITF Ireland 01A, Women Singles",singles,women,213,16558
16612,"ITF Ireland 01A, Women Doubles",doubles,women,213,16558
16614,"ITF Italy 20A, Women Singles",singles,women,213,16560
16616,"ITF Italy 20A, Women Doubles",doubles,women,213,16560
16618,"ITF Romania 06A, Women Singles",singles,women,213,16562
16620,"ITF Romania 06A, Women Doubles",doubles,women,213,16562
16622,"ITF USA 27A, Women Singles",singles,women,213,16564
16624,"ITF USA 27A, Women Doubles",doubles,women,213,16564
16640,"ITF Turkey F4, Men Doubles",doubles,men,785,15972
16644,"ITF Egypt F4, Men Doubles",doubles,men,785,15888
16646,"ITF Great Britain F2, Men Doubles",doubles,men,785,15890
16648,"ITF Indonesia F1, Men Doubles",doubles,men,785,15892
16656,"ITF Latvia F1, Men Singles",singles,men,785,16692
16658,"ITF Latvia F1, Men Doubles",doubles,men,785,16692
16662,"ITF Ukraine 01A, Women Singles",singles,women,213,16726
16664,"ITF Ukraine 01A, Women Doubles",doubles,women,213,16726
16742,"ITF Portugal F14, Men Singles",singles,men,785,16670
16744,"ITF Portugal F14, Men Doubles",doubles,men,785,16670
16746,"ITF Romania F8, Men Doubles",doubles,men,785,16672
16748,"ITF Romania F8, Men Singles",singles,men,785,16672
16750,"ITF Turkiye F28, Men Singles",singles,men,785,16674
16752,"ITF Turkiye F28, Men Doubles",doubles,men,785,16674
16754,"ITF USA F26, Men Doubles",doubles,men,785,16676
16756,"ITF USA F26, Men Singles",singles,men,785,16676
16758,"ITF Austria F5, Men Singles",singles,men,785,16678
16760,"ITF Austria F5, Men Doubles",doubles,men,785,16678
16762,"ITF Belgium F7, Men Doubles",doubles,men,785,16680
16764,"ITF Belgium F7, Men Singles",singles,men,785,16680
16766,"ITF Colombia F3, Men Singles",singles,men,785,16682
16768,"ITF Colombia F3, Men Doubles",doubles,men,785,16682
16770,"ITF Egypt F23, Men Singles",singles,men,785,16684
16772,"ITF Egypt F23, Men Doubles",doubles,men,785,16684
16774,"ITF Macedonia F2, Men Doubles",doubles,men,785,16688
16776,"ITF Macedonia F2, Men Singles",singles,men,785,16688
16778,"ITF Germany F9, Men Singles",singles,men,785,16690
16780,"ITF Germany F9, Men Doubles",doubles,men,785,16690
16782,"ITF Morocco F3, Men Singles",singles,men,785,16694
16784,"ITF Morocco F3, Men Doubles",doubles,men,785,16694
16786,"ITF Poland F8, Men Singles",singles,men,785,16696
16788,"ITF Poland F8, Men Doubles",doubles,men,785,16696
16790,"ITF Russia F5, Men Singles",singles,men,785,16698
16792,"ITF Russia F5, Men Doubles",doubles,men,785,16698
16794,"ITF Slovakia F2, Men Doubles",doubles,men,785,16700
16796,"ITF Slovakia F2, Men Singles",singles,men,785,16700
16798,"ITF Thailand F4, Men Singles",singles,men,785,16702
16800,"ITF Thailand F4, Men Doubles",doubles,men,785,16702
16802,"ITF USA 23A, Women Singles",singles,women,213,16704
16804,"ITF USA 23A, Women Doubles",doubles,women,213,16704
16806,"ITF Germany 12A, Women Singles",singles,women,213,16706
16808,"ITF Germany 12A, Women Doubles",doubles,women,213,16706
16810,"ITF Great Britain 12A, Women Singles",singles,women,213,16708
16812,"ITF Great Britain 12A, Women Doubles",doubles,women,213,16708
16814,"ITF Spain 14A, Women Singles",singles,women,213,16710
16816,"ITF Spain 14A, Women Doubles",doubles,women,213,16710
16818,"ITF USA 24A, Women Singles",singles,women,213,16712
16820,"ITF USA 24A, Women Doubles",doubles,women,213,16712
16822,"ITF Egypt 23A, Women Singles",singles,women,213,16714
16824,"ITF Egypt 23A, Women Doubles",doubles,women,213,16714
16826,"ITF Finland 02A, Women Doubles",doubles,women,213,16716
16828,"ITF Finland 02A, Women Singles",singles,women,213,16716
16830,"ITF Romania 07A, Women Singles",singles,women,213,16720
16832,"ITF Romania 07A, Women Doubles",doubles,women,213,16720
16834,"ITF Thailand 10A, Women Singles",singles,women,213,16722
16836,"ITF Thailand 10A, Women Doubles",doubles,women,213,16722
16838,"ITF Turkiye 27A, Women Doubles",doubles,women,213,16724
16840,"ITF Turkiye 27A, Women Singles",singles,women,213,16724
16852,"ITF Spain F4, Men Singles",singles,men,785,15894
16854,"ITF Tunisia F5, Men Doubles",doubles,men,785,15898
16856,"ITF Turkey F5, Men Doubles",doubles,men,785,15900
16858,"ITF China F1, Men Singles",singles,men,785,15904
16860,"ITF China F1, Men Doubles",doubles,men,785,15904
16862,"ITF Egypt F5, Men Singles",singles,men,785,15906
16864,"ITF Egypt F5, Men Doubles",doubles,men,785,15906
16866,"ITF Great Britain F3, Men Singles",singles,men,785,15908
16868,"ITF Great Britain F3, Men Doubles",doubles,men,785,15908
16870,"ITF India F1, Men Singles",singles,men,785,15910
16872,"ITF India F1, Men Doubles",doubles,men,785,15910
16874,"ITF Spain F5, Men Singles",singles,men,785,15914
16876,"ITF Spain F5, Men Doubles",doubles,men,785,15914
16878,"ITF Tunisia F6, Men Singles",singles,men,785,15916
16880,"ITF Tunisia F6, Men Doubles",doubles,men,785,15916
16886,"ITF Portugal 09A, Women Doubles",doubles,women,213,16884
16888,"ITF Portugal 09A, Women Singles",singles,women,213,16884
16896,"ITF Portugal 07A, Women Singles",singles,women,213,16894
16900,"ITF Poland 03A, Women Singles",singles,women,213,17038
16902,"ITF Poland 03A, Women Doubles",doubles,women,213,17038
16922,"ITF Italy F25, Men Singles",singles,men,785,16920
16924,"ITF Italy F25, Men Doubles",doubles,men,785,16920
16928,"ITF USA F27, Men Singles",singles,men,785,16926
16930,"ITF USA F27, Men Doubles",doubles,men,785,16926
16934,"ITF Germany 07A, Women Singles",singles,women,213,16932
16936,"ITF Germany 07A, Women Doubles",doubles,women,213,16932
16940,"ITF Austria F6, Men Singles",singles,men,785,16938
16942,"ITF Austria F6, Men Doubles",doubles,men,785,16938
16946,"ITF Belarus F1, Men Singles",singles,men,785,16944
16948,"ITF Belarus F1, Men Doubles",doubles,men,785,16944
16952,"ITF Belgium F8, Men Singles",singles,men,785,16950
16954,"ITF Belgium F8, Men Doubles",doubles,men,785,16950
16958,"ITF Finland F2, Men Singles",singles,men,785,16956
16960,"ITF Finland F2, Men Doubles",doubles,men,785,16956
16964,"ITF Germany F10, Men Singles",singles,men,785,16962
16966,"ITF Germany F10, Men Doubles",doubles,men,785,16962
16970,"ITF Portugal F15, Men Singles",singles,men,785,16968
16972,"ITF Portugal F15, Men Doubles",doubles,men,785,16968
16976,"ITF Romania F9, Men Singles",singles,men,785,16974
16978,"ITF Romania F9, Men Doubles",doubles,men,785,16976
16982,"ITF Russia F6, Men Singles",singles,men,785,16980
16984,"ITF Russia F6, Men Doubles",doubles,men,785,16980
16988,"ITF Serbia F1, Men Singles",singles,men,785,16986
16990,"ITF Serbia F1, Men Doubles",doubles,men,785,16986
16994,"ITF Slovakia F3, Men Singles",singles,men,785,16992
16996,"ITF Slovakia F3, Men Doubles",doubles,men,785,16992
17000,"ITF Thailand F5, Men Singles",singles,men,785,16998
17002,"ITF Thailand F5, Men Doubles",doubles,men,785,16998
17006,"ITF Turkiye F29, Men Singles",singles,men,785,17004
17008,"ITF Turkiye F29, Men Doubles",doubles,men,785,17004
17012,"ITF Belgium 04A, Women Singles",singles,women,213,17010
17014,"ITF Belgium 04A, Women Doubles",doubles,women,213,17010
17018,"ITF Great Britain 13A, Women Singles",singles,women,213,17016
17020,"ITF Great Britain 13A, Women Doubles",doubles,women,213,17016
17024,"ITF USA 25A, Women Singles",singles,women,213,17022
17026,"ITF USA 25A, Women Doubles",doubles,women,213,17022
17032,"ITF Austria 01A, Women Singles",singles,women,213,17030
17034,"ITF Austria 01A, Women Doubles",doubles,women,213,17030
17044,"ITF Romania 08A, Women Singles",singles,women,213,17040
17046,"ITF Romania 08A, Women Doubles",doubles,women,213,17040
17048,"ITF Russia 05A, Women Singles",singles,women,213,17042
17050,"ITF Russia 05A, Women Doubles",doubles,women,213,17042
17054,"ITF Spain 12A, Women Singles",singles,women,213,17052
17056,"ITF Spain 12A, Women Doubles",doubles,women,213,17052
17060,"ITF Thailand 11A, Women Doubles",doubles,women,213,17058
17062,"ITF Thailand 11A, Women Singles",singles,women,213,17058
17066,"ITF Turkey 28B, Women Singles",singles,women,213,17064
17068,"ITF Turkey 28B, Women Doubles",doubles,women,213,17064
17074,"ITF Turkey F6, Men Singles",singles,men,785,15918
17076,"ITF Turkey F6, Men Doubles",doubles,men,785,15918
17078,"ITF USA F7, Men Singles",singles,men,785,15920
17080,"ITF USA F7, Men Doubles",doubles,men,785,15920
17082,"ITF China F2, Men Singles",singles,men,785,15922
17084,"ITF China F2, Men Doubles",doubles,men,785,15922
17086,"ITF Tunisia F7, Men Singles",singles,men,785,15932
17088,"ITF Tunisia F7, Men Doubles",doubles,men,785,15932
17090,"ITF Egypt F6, Men Singles",singles,men,785,15924
17092,"ITF Egypt F6, Men Doubles",doubles,men,785,15924
17094,"ITF Turkey F7, Men Singles",singles,men,785,15934
17096,"ITF Turkey F7, Men Doubles",doubles,men,785,15934
17098,"ITF USA F8, Men Singles",singles,men,785,15936
17100,"ITF USA F8, Men Doubles",doubles,men,785,15936
17102,"ITF Indonesia F3, Men Singles",singles,men,785,15928
17104,"ITF Indonesia F3, Men Doubles",doubles,men,785,15928
17108,"ITF Canada F1, Men Singles",singles,men,785,15938
17110,"ITF Canada F1, Men Doubles",doubles,men,785,15938
17112,"ITF France F4, Men Singles",singles,men,785,15940
17114,"ITF France F4, Men Doubles",doubles,men,785,15940
17116,"ITF Italy F2, Men Singles",singles,men,785,15942
17118,"ITF Italy F2, Men Doubles",doubles,men,785,15942
17120,"ITF China F3, Men Singles",singles,men,785,15944
17122,"ITF China F3, Men Doubles",doubles,men,785,15944
17124,"ITF Egypt F7, Men Doubles",doubles,men,785,15946
17126,"ITF Portugal F1, Men Singles",singles,men,785,16124
17128,"ITF Tunisia F8, Men Doubles",doubles,men,785,15952
17130,"ITF Turkey F8, Men Doubles",doubles,men,785,15954
17142,"ITF Portugal F16, Men Singles",singles,men,785,17206
17144,"ITF Portugal F16, Men Doubles",doubles,men,785,17206
17148,"ITF Italy 22A, Women Singles",singles,women,213,17278
17150,"ITF Italy 22A, Women Doubles",doubles,women,213,17278
17152,"ITF Spain 07B, Women Singles",singles,women,213,17146
17154,"ITF Poland 04A, Women Singles",singles,women,213,17286
17156,"ITF Poland 04A, Women Doubles",doubles,women,213,17286
17158,"ITF Spain 07B, Women Doubles",doubles,women,213,17146
17168,"ITF USA F6, Men Doubles",doubles,men,785,15974
17172,"ITF Poland F9, Men Singles",singles,men,785,17170
17174,"ITF Poland F9, Men Doubles",doubles,men,785,17170
17178,"ITF Belarus F2, Men Singles",singles,men,785,17176
17180,"ITF Belarus F2, Men Doubles",doubles,men,785,17176
17184,"ITF Belgium F9, Men Singles",singles,men,785,17182
17186,"ITF Belgium F9, Men Doubles",doubles,men,785,17182
17190,"ITF Finland F3, Men Singles",singles,men,785,17188
17192,"ITF Finland F3, Men Doubles",doubles,men,785,17188
17196,"ITF Germany F11, Men Singles",singles,men,785,17194
17198,"ITF Germany F11, Men Doubles",doubles,men,785,17194
17202,"ITF Netherlands F5, Men Singles",singles,men,785,17200
17204,"ITF Netherlands F5, Men Doubles",doubles,men,785,17200
17210,"ITF Romania F10, Men Singles",singles,men,785,17208
17212,"ITF Romania F10, Men Doubles",doubles,men,785,17208
17216,"ITF Russia F7, Men Singles",singles,men,785,17214
17218,"ITF Russia F7, Men Doubles",doubles,men,785,17214
17222,"ITF Serbia F2, Men Singles",singles,men,785,17220
17224,"ITF Serbia F2, Men Doubles",doubles,men,785,17220
17228,"ITF Spain F25, Men Singles",singles,men,785,17226
17230,"ITF Spain F25, Men Doubles",doubles,men,785,17226
17234,"ITF Canada 01A, Women Singles",singles,women,213,17232
17236,"ITF Canada 01A, Women Doubles",doubles,women,213,17232
17242,"ITF Germany 13A, Women Singles",singles,women,213,17238
17244,"ITF Germany 13A, Women Doubles",doubles,women,213,17238
17248,"ITF Switzerland 03A, Women Singles",singles,women,213,17246
17250,"ITF Switzerland 03A, Women Doubles",doubles,women,213,17246
17254,"ITF Thailand 12A, Women Singles",singles,women,213,17252
17256,"ITF Thailand 12A, Women Doubles",doubles,women,213,17252
17260,"ITF Austria 02A, Women Singles",singles,women,213,17258
17262,"ITF Austria 02A, Women Doubles",doubles,women,213,17258
17264,"ITF Thailand F6, Men Singles",singles,men,785,15978
17266,"ITF Thailand F6, Men Doubles",doubles,men,785,15978
17272,"ITF Turkey F30, Men Singles",singles,men,785,17270
17274,"ITF Turkey F30, Men Doubles",doubles,men,785,17270
17282,"ITF Netherlands 04A, Women Singles",singles,women,213,17280
17284,"ITF Netherlands 04A, Women Doubles",doubles,women,213,17280
17292,"ITF Russia 06A, Women Singles",singles,women,213,17290
17294,"ITF Russia 06A, Women Doubles",doubles,women,213,17290
17298,"ITF Spain 13A, Women Singles",singles,women,213,17296
17300,"ITF Spain 13A, Women Doubles",doubles,women,213,17296
17306,"ITF Australia F1, Men Singles",singles,men,785,16008
17308,"ITF Australia F1, Men Doubles",doubles,men,785,16008
17310,"ITF Canada F2, Men Singles",singles,men,785,16010
17312,"ITF Canada F2, Men Doubles",doubles,men,785,16010
17316,"ITF Croatia F1, Men Singles",singles,men,785,16012
17318,"ITF Croatia F1, Men Doubles",doubles,men,785,16012
17320,"ITF Egypt F8, Men Singles",singles,men,785,16014
17322,"ITF Egypt F8, Men Doubles",doubles,men,785,16014
17326,"ITF France F5, Men Singles",singles,men,785,16016
17328,"ITF France F5, Men Doubles",doubles,men,785,16016
17336,"ITF Japan F1, Men Singles",singles,men,785,16024
17338,"ITF Japan F1, Men Doubles",doubles,men,785,16024
17348,"ITF Belgium F10, Men Singles",singles,men,785,17484
17350,"ITF Belgium F10, Men Doubles",doubles,men,785,17484
17354,"ITF Italy F26, Men Singles",singles,men,785,17494
17356,"ITF Italy F26, Men Doubles",doubles,men,785,17494
17360,"ITF Portugal F17, Men Singles",singles,men,785,17512
17362,"ITF Portugal F17, Men Doubles",doubles,men,785,17512
17366,"ITF Romania F11, Men Singles",singles,men,785,17514
17368,"ITF Romania F11, Men Doubles",doubles,men,785,17514
17372,"ITF Switzerland F4, Men Singles",singles,men,785,17516
17374,"ITF Switzerland F4, Men Doubles",doubles,men,785,17516
17378,"ITF Turkiye 30A, Women Singles",singles,women,213,17518
17380,"ITF Turkiye 30A, Women Doubles",doubles,women,213,17518
17382,"ITF Poland 05A, Women Singles",singles,women,213,17556
17384,"ITF Poland 05A, Women Doubles",doubles,women,213,17556
17390,ITF Turkey F12 Men Singles,singles,men,785,16110
17392,ITF Turkey F12 Men Doubles,doubles,men,785,16110
17394,ITF Tunisia F12 Men Doubles,doubles,men,785,16108
17396,ITF Tunisia F12 Men Singles,singles,men,785,16108
17398,"ITF Portugal F4, Men Singles",singles,men,785,16106
17400,"ITF Portugal F4, Men Doubles",doubles,men,785,16106
17402,"ITF Japan F4, Men Singles",singles,men,785,16104
17404,"ITF Japan F4, Men Doubles",doubles,men,785,16104
17406,"ITF Israel F3, Men Singles",singles,men,785,16102
17408,"ITF Israel F3, Men Doubles",doubles,men,785,16102
17410,"ITF Indonesia F4, Men Singles",singles,men,785,16100
17412,"ITF Indonesia F4, Men Doubles",doubles,men,785,16100
17414,"ITF Greece F4, Men Singles",singles,men,785,16098
17416,"ITF Greece F4, Men Doubles",doubles,men,785,16098
17418,"ITF Egypt F11, Men Singles",singles,men,785,16096
17420,"ITF Egypt F11, Men Doubles",doubles,men,785,16096
17422,"ITF Bahrain F2, Men Singles",singles,men,785,16092
17424,"ITF Bahrain F2, Men Doubles",doubles,men,785,16092
17426,"ITF Spain F9, Men Singles",singles,men,785,16090
17428,"ITF Spain F9, Men Doubles",doubles,men,785,16090
17430,"ITF Italy F6, Men Singles",singles,men,785,16088
17432,"ITF Italy F6, Men Doubles",doubles,men,785,16088
17434,"ITF Turkey F11, Men Singles",singles,men,785,16086
17436,"ITF Turkey F11, Men Doubles",doubles,men,785,16086
17438,"ITF Tunisia F11, Men Singles",singles,men,785,16084
17440,"ITF Tunisia F11, Men Doubles",doubles,men,785,16084
17442,"ITF Spain F8, Men Singles",singles,men,785,16082
17444,"ITF Spain F8, Men Doubles",doubles,men,785,16082
17446,"ITF Japan F3, Men Singles",singles,men,785,16080
17448,"ITF Japan F3, Men Doubles",doubles,men,785,16080
17450,"ITF Israel F2, Men Singles",singles,men,785,16078
17452,"ITF Israel F2, Men Doubles",doubles,men,785,16078
17456,"ITF Poland F10, Men Singles",singles,men,785,17454
17458,"ITF Poland F10, Men Doubles",doubles,men,785,17454
17462,"ITF Spain F26, Men Singles",singles,men,785,17460
17464,"ITF Spain F26, Men Doubles",doubles,men,785,17460
17468,"ITF Turkey F31, Men Singles",singles,men,785,17466
17470,"ITF Turkey F31, Men Doubles",doubles,men,785,17466
17474,"ITF Argentina F4, Men Singles",singles,men,785,17472
17476,"ITF Argentina F4, Men Doubles",doubles,men,785,17472
17480,"ITF Belarus F3, Men Singles",singles,men,785,17478
17482,"ITF Belarus F3, Men Doubles",doubles,men,785,17478
17488,"ITF Germany F12, Men Singles",singles,men,785,17486
17490,"ITF Germany F12, Men Doubles",doubles,men,785,17486
17500,"ITF Netherlands F6, Men Singles",singles,men,785,17498
17502,"ITF Netherlands F6, Men Doubles",doubles,men,785,17498
17508,"ITF Serbia F3, Men Singles",singles,men,785,17506
17510,"ITF Serbia F3, Men Doubles",doubles,men,785,17506
17522,"ITF Germany 14A, Women Singles",singles,women,213,17520
17524,"ITF Germany 14A, Women Doubles",doubles,women,213,17520
