id,name,type,gender,category_id,parent_id
620,Hopman Cup,mixed,mixed,181,
660,World Team Cup,mixed,men,3,
990,ATP Challenger Tour Finals,singles,men,72,6239
1207,Championship International Series,singles,women,6,
2100,Davis Cup,mixed,men,76,
2102,Billie Jean King Cup,mixed,women,74,
2555,Wimbledon Men Singles,singles,men,3,2553
2557,Wimbledon Men Doubles,doubles,men,3,2553
2559,Wimbledon Women Singles,singles,women,6,2553
2561,Wimbledon Women Doubles,doubles,women,6,2553
2563,Wimbledon Mixed Doubles,mixed_doubles,mixed,3,2553
2567,Australian Open Men Singles,singles,men,3,2565
2569,Australian Open Men Doubles,doubles,men,3,2565
2571,Australian Open Women Singles,singles,women,6,2565
2573,Australian Open Women Doubles,doubles,women,6,2565
2575,Australian Open Mixed Doubles,mixed_doubles,mixed,3,2565
2579,French Open Men Singles,singles,men,3,2577
2581,French Open Men Doubles,doubles,men,3,2577
2583,French Open Women Singles,singles,women,6,2577
2585,French Open Women Doubles,doubles,women,6,2577
2587,French Open Mixed Doubles,mixed_doubles,mixed,3,2577
2591,US Open Men Singles,singles,men,3,2589
2593,US Open Men Doubles,doubles,men,3,2589
2595,US Open Women Singles,singles,women,6,2589
2597,US Open Women Doubles,doubles,women,6,2589
2599,US Open Mixed Doubles,mixed_doubles,mixed,3,2589
2603,"ATP Doha, Qatar Men Singles",singles,men,3,2601
2605,"ATP Doha, Qatar Men Doubles",doubles,men,3,2601
2613,"ATP Basel, Switzerland Men Singles",singles,men,3,2611
2615,"ATP Basel, Switzerland Men Doubles",doubles,men,3,2611
2619,"ATP Brisbane, Australia Men Singles",singles,men,3,2617
2621,"ATP Brisbane, Australia Men Doubles",doubles,men,3,2617
2625,"ATP Chennai, India Men Singles",singles,men,3,2623
2627,"ATP Chennai, India Men Doubles",doubles,men,3,2623
2631,"ATP Auckland, New Zealand Men Singles",singles,men,3,2629
2633,"ATP Auckland, New Zealand Men Doubles",doubles,men,3,2629
2637,"ATP Sydney, Australia Men Singles",singles,men,3,2635
2639,"ATP Sydney, Australia Men Doubles",doubles,men,3,2635
2649,"ATP Zagreb, Croatia Men Singles",singles,men,3,2647
2651,"ATP Zagreb, Croatia Men Double",doubles,men,3,2647
2661,"ATP Paris, France Men Singles",singles,men,3,2659
2663,"ATP Paris, France Men Doubles",doubles,men,3,2659
2667,"ATP Dubai, UAE Men Singles",singles,men,3,2665
2669,"ATP Dubai, UAE Men Doubles",doubles,men,3,2665
2673,"WTA Pattaya City, Thailand Women Singles",singles,women,6,2671
2675,"WTA Pattaya City, Thailand Women Doubles",doubles,women,6,2671
2679,"ATP Rotterdam, Netherlands Men Singles",singles,men,3,2677
2681,"ATP Rotterdam, Netherlands Men Doubles",doubles,men,3,2677
2697,"ATP Memphis, USA Men Singles",singles,men,3,2695
2699,"ATP Memphis, USA Men Doubles",doubles,men,3,2695
2703,"WTA Bogota, Colombia Women Singles",singles,women,6,2701
2705,"WTA Bogota, Colombia Women Doubles",doubles,women,6,2701
2709,"ATP Acapulco, Mexico Men Singles",singles,men,3,2707
2711,"ATP Acapulco, Mexico Men Doubles",doubles,men,3,2707
2715,"WTA Monterrey, Mexico Women Singles",singles,women,6,2713
2717,"WTA Monterrey, Mexico Women Doubles",doubles,women,6,2713
2721,"ATP Marseille, France Men Singles",singles,men,3,2719
2723,"ATP Marseille, France Men Doubles",doubles,men,3,2719
2727,"ATP Buenos Aires, Argentina Men Singles",singles,men,3,2725
2729,"ATP Buenos Aires, Argentina Men Doubles",doubles,men,3,2725
2733,"ATP Delray Beach, USA Men Singles",singles,men,3,2731
2735,"ATP Delray Beach, USA Men Doubles",doubles,men,3,2731
2739,"ATP Indian Wells, USA Men Singles",singles,men,3,2737
2741,"ATP Indian Wells, USA Men Doubles",doubles,men,3,2737
2745,"ATP Miami, USA Men Singles",singles,men,3,2743
2747,"ATP Miami, USA Men Doubles",doubles,men,3,2743
2751,"ATP Houston, USA Men Singles",singles,men,3,2749
2753,"ATP Houston, USA Men Doubles",doubles,men,3,2749
2757,"ATP Casablanca, Morocco Men Singles",singles,men,3,2755
2759,"ATP Casablanca, Morocco Men Doubles",doubles,men,3,2755
2763,"WTA Charleston, USA Women Singles",singles,women,6,2761
2765,"WTA Charleston, USA Women Doubles",doubles,women,6,2761
2769,"ATP Barcelona, Spain Men Singles",singles,men,3,2767
2771,"ATP Barcelona, Spain Men Doubles",doubles,men,3,2767
2775,"ATP Stuttgart, Germany Men Singles",singles,men,3,2773
2777,"ATP Stuttgart, Germany Men Doubles",doubles,men,3,2773
2781,"ATP Rome, Italy Men Singles",singles,men,3,2779
2783,"ATP Rome, Italy Men Doubles",doubles,men,3,2779
2787,"ATP Madrid, Spain Men Singles",singles,men,3,2785
2789,"ATP Madrid, Spain Men Doubles",doubles,men,3,2785
2793,"Berlin, Germany Women Singles",singles,women,6,2791
2795,"Berlin, Germany Women Doubles",doubles,women,6,2791
2805,"WTA Hobart, Australia Women Singles",singles,women,6,2803
2807,"WTA Hobart, Australia Women Doubles",doubles,women,6,2803
2817,"WTA Marrakech, Morocco Women Singles",singles,women,6,2815
2819,"WTA Marrakech, Morocco Women Doubles",doubles,women,6,2815
2823,"WTA Strasbourg, France Women Singles",singles,women,6,2821
2825,"WTA Strasbourg, France Women Doubles",doubles,women,6,2821
2829,"ATP Challenger Amersfoort, Netherlands Men Singles",singles,men,72,2827
2831,"ATP Challenger Amersfoort, Netherlands Men Doubles",doubles,men,72,2827
2835,"ATP Munich, Germany Men Singles",singles,men,3,2833
2837,"ATP Munich, Germany Men Doubles",doubles,men,3,2833
2853,"WTA Birmingham, Great Britain Women Singles",singles,women,6,2851
2855,"WTA Birmingham, Great Britain Women Doubles",doubles,women,6,2851
2859,"ATP Halle, Germany Men Singles",singles,men,3,2857
2861,"ATP Halle, Germany Men Doubles",doubles,men,3,2857
2865,"ATP London, Great Britain Men Singles",singles,men,3,2863
2867,"ATP London, Great Britain Men Doubles",doubles,men,3,2863
2871,"ATP S-Hertogenbosch, Netherlands Men Singles",singles,men,3,2869
2873,"ATP S-Hertogenbosch, Netherlands Men Doubles",doubles,men,3,2869
2877,"WTA Eastbourne, Great Britain Women Singles",singles,women,6,7629
2879,"WTA Eastbourne, Great Britain Women Doubles",doubles,women,6,7629
2883,"ATP Newport, USA Men Singles",singles,men,3,2881
2885,"ATP Newport, USA Men Doubles",doubles,men,3,2881
2889,"ATP Bastad, Sweden Men Singles",singles,men,3,2887
2891,"ATP Bastad, Sweden Men Doubles",doubles,men,3,2887
2895,"WTA Budapest, Hungary Women Singles",singles,women,6,2893
2897,"WTA Budapest, Hungary Women Doubles",doubles,women,6,2893
2901,"WTA Palermo, Italy Women Singles",singles,women,6,2899
2903,"WTA Palermo, Italy Women Doubles",doubles,women,6,2899
2907,"WTA Prague, Czech Republic Women Singles",singles,women,6,2905
2909,"WTA Prague, Czech Republic Women Doubles",doubles,women,6,2905
2913,"Portoroz, Slovenia Women Singles",singles,women,6,2911
2915,"Portoroz, Slovenia Women Doubles",doubles,women,6,2911
2935,"ATP Hamburg, Germany Men Singles",singles,men,3,2933
2937,"ATP Hamburg, Germany Men Doubles",doubles,men,3,2933
2941,"WTA San Jose, USA Women Singles",singles,women,6,2689
2943,"WTA San Jose, USA Women Doubles",doubles,women,6,2689
2947,"WTA Istanbul, Turkey Women Singles",singles,women,6,2945
2949,"WTA Istanbul, Turkey Women Doubles",doubles,women,6,2945
2959,"ATP Gstaad, Switzerland Men Singles",singles,men,3,2957
2961,"ATP Gstaad, Switzerland Men Doubles",doubles,men,3,2957
2965,"ATP Umag, Croatia Men Singles",singles,men,3,2963
2967,"ATP Umag, Croatia Men Doubles",doubles,men,3,2963
2971,"ATP Washington, USA Men Singles",singles,men,3,2969
2973,"ATP Washington, USA Men Doubles",doubles,men,3,2969
2977,"WTA Montreal, Canada Women Singles",singles,women,6,2975
2979,"WTA Montreal, Canada Women Doubles",doubles,women,6,2975
2983,"ATP Cincinnati, USA Men Singles",singles,men,3,2981
2985,"ATP Cincinnati, USA Men Doubles",doubles,men,3,2981
2989,"WTA New Haven, USA Women Singles",singles,women,6,2987
2991,"WTA New Haven, USA Women Doubles",doubles,women,6,2987
2995,"ATP Toronto, Canada Men Singles",singles,men,3,2993
2997,"ATP Toronto, Canada Men Doubles",doubles,men,3,2993
3001,"ATP Metz, France Men Singles",singles,men,3,2999
3003,"ATP Metz, France Men Doubles",doubles,men,3,2999
3007,"ATP Bucharest, Romania Men Singles",singles,men,3,3005
3009,"ATP Bucharest, Romania Men Doubles",doubles,men,3,3005
3013,"WTA Guangzhou, China Women Singles",singles,women,6,3011
3015,"WTA Guangzhou, China Women Doubles",doubles,women,6,3011
3025,"ATP Beijing, China Men Singles",singles,men,3,3023
3027,"ATP Beijing, China Men Doubles",doubles,men,3,3023
3031,"ATP Tokyo, Japan Men Singles",singles,men,3,3029
3033,"ATP Tokyo, Japan Men Doubles",doubles,men,3,3029
3037,"WTA Quebec City, Canada Women Singles",singles,women,6,3035
3039,"WTA Quebec City, Canada Women Doubles",doubles,women,6,3035
3043,"WTA Seoul, Korea Republic Women Singles",singles,women,6,3041
3045,"WTA Seoul, Korea Republic Women Doubles",doubles,women,6,3041
3049,"WTA Tashkent, Uzbekistan Women Singles",singles,women,6,3047
3051,"WTA Tashkent, Uzbekistan Women Doubles",doubles,women,6,3047
3055,"WTA Linz, Austria Women Singles",singles,women,6,3053
3057,"WTA Linz, Austria Women Doubles",doubles,women,6,3053
3061,"WTA Osaka, Japan Women Singles",singles,women,6,3059
3063,"WTA Osaka, Japan Women Doubles",doubles,women,6,3059
3067,"ATP Moscow, Russia Men Singles",singles,men,3,3065
3069,"ATP Moscow, Russia Men Doubles",doubles,men,3,3065
3073,"WTA Luxembourg, Luxembourg Women Singles",singles,women,6,3071
3075,"WTA Luxembourg, Luxembourg Women Doubles",doubles,women,6,3071
3085,"ATP Shanghai, China Men Singles",singles,men,3,3083
3087,"ATP Shanghai, China Men Doubles",doubles,men,3,3083
3091,"ATP Stockholm, Sweden Men Singles",singles,men,3,3089
3093,"ATP Stockholm, Sweden Men Doubles",doubles,men,3,3089
3097,"ATP Lyon, France Men Singles",singles,men,3,3095
3099,"ATP Lyon, France Men Doubles",doubles,men,3,3095
3103,"ATP Vienna, Austria Men Singles",singles,men,3,3101
3105,"ATP Vienna, Austria Men Doubles",doubles,men,3,3101
3109,"ATP St. Petersburg, Russia Men Singles",singles,men,3,3107
3111,"ATP St. Petersburg, Russia Men Doubles",doubles,men,3,3107
3121,"ATP Monte Carlo, Monaco Men Singles",singles,men,3,3119
3123,"ATP Monte Carlo, Monaco Men Doubles",doubles,men,3,3119
3145,"WTA Antwerp, Belgium Women Singles",singles,women,6,3143
3147,"WTA Antwerp, Belgium Women Doubles",doubles,women,6,3143
3151,"ATP Kitzbuhel, Austria Men Singles",singles,men,3,3149
3153,"ATP Kitzbuhel, Austria Men Doubles",doubles,men,3,3149
3163,"San Diego, USA Women Singles",singles,women,6,3161
3165,"San Diego, USA Women Doubles",doubles,women,6,3161
3181,"ATP Nottingham, Great Britain Men Singles",singles,men,3,3179
3183,"ATP Nottingham, Great Britain Men Doubles",doubles,men,3,3179
3215,"ATP Challenger Charlottesville, USA Men Doubles",doubles,men,72,3213
3217,"ATP Challenger Charlottesville, USA Men Singles",singles,men,72,3213
3221,"ATP Challenger Noumea, New Caledonia Men Singles",singles,men,72,3219
3223,"ATP Challenger Noumea, New Caledonia Men Doubles",doubles,men,72,3219
3227,"ATP Challenger Sao Paulo, Brazil Men Singles",singles,men,72,3225
3229,"ATP Challenger Sao Paulo, Brazil Men Doubles",doubles,men,72,3225
3233,"ATP Challenger Salinas, Ecuador Men Singles",singles,men,72,3231
3235,"ATP Challenger Salinas, Ecuador Men Doubles",doubles,men,72,3231
3239,"ATP Santiago, Chile Men Singles",singles,men,3,3237
3241,"ATP Santiago, Chile Men Doubles",doubles,men,3,3237
3245,"ATP Atlanta, USA Men Singles",singles,men,3,3243
3247,"ATP Atlanta, USA Men Doubles",doubles,men,3,3243
3251,"ATP Belgrade, Serbia Men Singles",singles,men,3,3249
3253,"ATP Belgrade, Serbia Men Doubles",doubles,men,3,3249
3257,"ATP Kuala Lumpur, Malaysia Men Singles",singles,men,3,3255
3259,"ATP Kuala Lumpur, Malaysia Men Doubles",doubles,men,3,3255
3263,"ATP Nice, France Men Singles",singles,men,3,3261
3265,"ATP Nice, France Men Doubles",doubles,men,3,3261
3281,"ATP Challenger Barletta, Italy Men Singles",singles,men,72,3279
3283,"ATP Challenger Barletta, Italy Men Doubles",doubles,men,72,3279
3287,"ATP Challenger Bergamo, Italy Men Singles",singles,men,72,3285
3289,"ATP Challenger Bergamo, Italy Men Doubles",doubles,men,72,3285
3293,"ATP Challenger Floridablanca-Bucaramanga, Colombia Men Singles",singles,men,72,3291
3295,"ATP Challenger Floridablanca-Bucaramanga, Colombia Men Doubles",doubles,men,72,3291
3299,"ATP Challenger Heilbronn, Germany Men Singles",singles,men,72,3297
3301,"ATP Challenger Heilbronn, Germany Men Doubles",doubles,men,72,3297
3311,"ATP Challenger Burnie, Australia Men Singles",singles,men,72,3309
3313,"ATP Challenger Burnie, Australia Men Doubles",doubles,men,72,3309
3321,"ATP Challenger Caltanissetta, Italy Men Singles",singles,men,72,3319
3323,"ATP Challenger Caltanissetta, Italy Men Doubles",doubles,men,72,3319
3327,"ATP Challenger Cherbourg, France Men Singles",singles,men,72,3325
3329,"ATP Challenger Cherbourg, France Men Doubles",doubles,men,72,3325
3343,"ATP Challenger Kazan, Russia Men Singles",singles,men,72,3341
3345,"ATP Challenger Kazan, Russia Men Doubles",doubles,men,72,3341
3349,"ATP Challenger Kyoto, Japan Men Singles",singles,men,72,3347
3351,"ATP Challenger Kyoto, Japan Men Doubles",doubles,men,72,3347
3367,"ATP Challenger Meknes, Morocco Men Singles",singles,men,72,3365
3369,"ATP Challenger Meknes, Morocco Men Doubles",doubles,men,72,3365
3379,"ATP Challenger San Luis Potosi, Mexico Men Singles",singles,men,72,3377
3381,"ATP Challenger San Luis Potosi, Mexico Men Doubles",doubles,men,72,3377
3391,"ATP Challenger St. Brieuc, France Men Singles",singles,men,72,3389
3393,"ATP Challenger St. Brieuc, France Men Doubles",doubles,men,72,3389
3425,"ATP Challenger Biella, Italy Men Singles",singles,men,72,3423
3427,"ATP Challenger Biella, Italy Men Doubles",doubles,men,72,3423
3431,"ATP Challenger Blumenau, Brazil Men Singles",singles,men,72,3429
3433,"ATP Challenger Blumenau, Brazil Men Doubles",doubles,men,72,3429
3437,"ATP Challenger Bordeaux, France Men Singles",singles,men,72,3435
3439,"ATP Challenger Bordeaux, France Men Doubles",doubles,men,72,3435
3447,"ATP Challenger Busan, Korea Republic Men Singles",singles,men,72,3445
3449,"ATP Challenger Busan, Korea Republic Men Doubles",doubles,men,72,3445
3453,"ATP Challenger Cairo, Egypt Men Singles",singles,men,72,3451
3455,"ATP Challenger Cairo, Egypt Men Doubles",doubles,men,72,3451
3469,"ATP Challenger Fergana, Uzbekistan Men Singles",singles,men,72,3467
3471,"ATP Challenger Fergana, Uzbekistan Men Doubles",doubles,men,72,3467
3475,"ATP Challenger Furth, Germany Men Singles",singles,men,72,3473
3477,"ATP Challenger Furth, Germany Men Doubles",doubles,men,72,3473
3481,"ATP Challenger Leon, Mexico Men Singles",singles,men,72,3479
3483,"ATP Challenger Leon, Mexico Men Doubles",doubles,men,72,3479
3493,"ATP Challenger Monza, Italy Men Singles",singles,men,72,3491
3495,"ATP Challenger Monza, Italy Men Doubles",doubles,men,72,3491
3499,"ATP Challenger Ostrava, Czech Republic Men Singles",singles,men,72,3497
3501,"ATP Challenger Ostrava, Czech Republic Men Doubles",doubles,men,72,3497
3505,"ATP Challenger Pereira, Colombia Men Singles",singles,men,72,3503
3507,"ATP Challenger Pereira, Colombia Men Doubles",doubles,men,72,3503
3511,"ATP Challenger Prostejov, Czech Republic Men Singles",singles,men,72,3509
3513,"ATP Challenger Prostejov, Czech Republic Men Doubles",doubles,men,72,3509
3525,"ATP Challenger San Remo, Italy Men Singles",singles,men,72,3523
3529,"ATP Challenger Sarasota, USA Men Singles",singles,men,72,3527
3531,"ATP Challenger Sarasota, USA Men Doubles",doubles,men,72,3527
3535,"ATP Challenger Savannah, USA Men Singles",singles,men,72,3533
3537,"ATP Challenger Savannah, USA Men Doubles",doubles,men,72,3533
3541,"ATP Challenger Tallahassee, USA Men Singles",singles,men,72,3539
3543,"ATP Challenger Tallahassee, USA Men Doubles",doubles,men,72,3539
3547,"ATP Challenger Tunis, Tunisia Men Singles",singles,men,72,3545
3549,"ATP Challenger Tunis, Tunisia Men Doubles",doubles,men,72,3545
3553,"ATP Challenger Aptos, USA Men Singles",singles,men,72,3551
3555,"ATP Challenger Aptos, USA Men Doubles",doubles,men,72,3551
3571,"ATP Challenger Braunschweig, Germany Men Singles",singles,men,72,3569
3573,"ATP Challenger Braunschweig, Germany Men Doubles",doubles,men,72,3569
3581,"ATP Challenger Cordenons, Italy Men Singles",singles,men,72,3579
3583,"ATP Challenger Cordenons, Italy Men Doubles",doubles,men,72,3579
3587,"ATP Challenger Granby, Canada Men Singles",singles,men,72,3585
3589,"ATP Challenger Granby, Canada Men Doubles",doubles,men,72,3585
3599,"ATP Challenger Lexington, USA Men Singles",singles,men,72,3597
3601,"ATP Challenger Lexington, USA Men Doubles",doubles,men,72,3597
3605,"ATP Challenger Lugano, Switzerland Men Singles",singles,men,72,3603
3609,"ATP Challenger Marburg, Germany Men Singles",singles,men,72,3607
3611,"ATP Challenger Marburg, Germany Men Doubles",doubles,men,72,3607
3615,"ATP Challenger Milan, Italy Men Singles",singles,men,72,3613
3617,"ATP Challenger Milan, Italy Men Doubles",doubles,men,72,3613
3643,"ATP Challenger Poznan, Poland Men Singles",singles,men,72,3641
3645,"ATP Challenger Poznan, Poland Men Doubles",doubles,men,72,3641
3649,"ATP Challenger Pozoblanco, Spain Men Singles",singles,men,72,3647
3651,"ATP Challenger Pozoblanco, Spain Men Doubles",doubles,men,72,3647
3655,"ATP Challenger Recanati, Italy Men Singles",singles,men,72,3653
3657,"ATP Challenger Recanati, Italy Men Doubles",doubles,men,72,3653
3669,"ATP Challenger San Benedetto, Italy Men Singles",singles,men,72,3667
3671,"ATP Challenger San Benedetto, Italy Men Doubles",doubles,men,72,3667
3675,"ATP Challenger Scheveningen, Netherlands Men Singles",singles,men,72,3673
3677,"ATP Challenger Scheveningen, Netherlands Men Doubles",doubles,men,72,3673
3681,"ATP Challenger Tampere, Finland Men Singles",singles,men,72,3679
3683,"ATP Challenger Tampere, Finland Men Doubles",doubles,men,72,3679
3687,"ATP Challenger Turin, Italy Men Singles",singles,men,72,3685
3689,"ATP Challenger Turin, Italy Men Doubles",doubles,men,72,3685
3693,"ATP Challenger Winnetka, USA Men Singles",singles,men,72,3691
3695,"ATP Challenger Winnetka, USA Men Doubles",doubles,men,72,3691
3709,"ATP Challenger San Marino, San Marino Men Singles",singles,men,72,3707
3711,"ATP Challenger San Marino, San Marino Men Doubles",doubles,men,72,3707
3715,"ATP Challenger Segovia, Spain Men Singles",singles,men,72,3713
3717,"ATP Challenger Segovia, Spain Men Doubles",doubles,men,72,3713
3721,"ATP Challenger Vancouver, Canada Men Singles",singles,men,72,3719
3723,"ATP Challenger Vancouver, Canada Men Doubles",doubles,men,72,3719
3727,"ATP Challenger Binghamton, USA Men Singles",singles,men,72,3725
3729,"ATP Challenger Binghamton, USA Men Doubles",doubles,men,72,3725
3733,"ATP Challenger Samarkand, Uzbekistan Men Singles",singles,men,72,3731
3735,"ATP Challenger Samarkand, Uzbekistan Men Doubles",doubles,men,72,3731
3745,"ATP Challenger Karshi, Uzbekistan Men Singles",singles,men,72,3743
3747,"ATP Challenger Karshi, Uzbekistan Men Doubles",doubles,men,72,3743
3751,"Salvador, Brazil Men Singles",singles,men,72,3749
3761,"ATP Challenger Almaty, Kazakhstan Men Singles",singles,men,72,3759
3777,"ATP Challenger Como, Italy Men Singles",singles,men,72,3775
3779,"ATP Challenger Como, Italy Men Doubles",doubles,men,72,3775
3789,"ATP Challenger Alphen aan den Rijn, Netherlands Men Singles",singles,men,72,3787
3791,"ATP Challenger Alphen aan den Rijn, Netherlands Men Doubles",doubles,men,72,3787
3795,"ATP Challenger Brasov, Romania Men Singles",singles,men,72,3793
3797,"ATP Challenger Brasov, Romania Men Doubles",doubles,men,72,3793
3801,"ATP Challenger Genoa, Italy Men Singles",singles,men,72,3799
3803,"ATP Challenger Genoa, Italy Men Doubles",doubles,men,72,3799
3813,"ATP Challenger Seville, Spain Men Singles",singles,men,72,3811
3815,"ATP Challenger Seville, Spain Men Doubles",doubles,men,72,3811
3819,"ATP Challenger St. Remy, France Men Singles",singles,men,72,3817
3821,"ATP Challenger St. Remy, France Men Doubles",doubles,men,72,3817
3825,"ATP Challenger Banja Luka, Bosnia & Herzegovina Men Singles",singles,men,72,3823
3827,"ATP Challenger Banja Luka, Bosnia & Herzegovina Men Doubles",doubles,men,72,3823
3831,"ATP Challenger Szczecin, Poland Men Singles",singles,men,72,32985
3833,"ATP Challenger Szczecin, Poland Men Doubles",doubles,men,72,32985
3837,"ATP Challenger Todi, Italy Men Singles",singles,men,72,3835
3839,"ATP Challenger Todi, Italy Men Doubles",doubles,men,72,3835
3855,"ATP Challenger Trnava, Slovakia Men Singles",singles,men,72,3853
3857,"ATP Challenger Trnava, Slovakia Men Doubles",doubles,men,72,3853
3861,"ATP Challenger Cali, Colombia Men Singles",singles,men,72,3859
3863,"ATP Challenger Cali, Colombia Men Doubles",doubles,men,72,3859
3867,"ATP Challenger Montevideo, Uruguay Men Singles",singles,men,72,3865
3869,"ATP Challenger Montevideo, Uruguay Men Doubles",doubles,men,72,3865
3873,"ATP Challenger Mons, Belgium Men Singles",singles,men,72,3871
3875,"ATP Challenger Mons, Belgium Men Doubles",doubles,men,72,3871
3879,"ATP Challenger Quito, Ecuador Men Singles",singles,men,72,3877
3881,"ATP Challenger Quito, Ecuador Men Doubles",doubles,men,72,3877
3899,"ATP Challenger Rennes, France Men Singles",singles,men,72,3897
3901,"ATP Challenger Rennes, France Men Doubles",doubles,men,72,3897
3905,"ATP Challenger Tiburon, USA Men Singles",singles,men,72,3903
3907,"ATP Challenger Tiburon, USA Men Doubles",doubles,men,72,3903
3915,"ATP Challenger Orleans, France Men Singles",singles,men,72,3913
3917,"ATP Challenger Orleans, France Men Doubles",doubles,men,72,3913
3921,"ATP Challenger Astana, Kazakhstan Men Singles",singles,men,72,3919
3923,"ATP Challenger Astana, Kazakhstan Men Doubles",doubles,men,72,3919
3927,"ATP Challenger Eckental, Germany Men Singles",singles,men,72,3925
3929,"ATP Challenger Eckental, Germany Men Doubles",doubles,men,72,3925
3933,"ATP Challenger Medellin, Colombia Men Singles",singles,men,72,3931
3935,"ATP Challenger Medellin, Colombia Men Doubles",doubles,men,72,3931
3945,"ATP Challenger Guayaquil, Ecuador Men Singles",singles,men,72,3943
3947,"ATP Challenger Guayaquil, Ecuador Men Doubles",doubles,men,72,3943
3951,"ATP Challenger Knoxville, USA Men Singles",singles,men,72,3949
3953,"ATP Challenger Knoxville, USA Men Doubles",doubles,men,72,3949
3957,"ATP Challenger Ortisei, Italy Men Singles",singles,men,72,3955
3959,"ATP Challenger Ortisei, Italy Men Doubles",doubles,men,72,3955
3963,"ATP Challenger Bratislava, Slovakia Men Singles",singles,men,72,3961
3965,"ATP Challenger Bratislava, Slovakia Men Doubles",doubles,men,72,3961
3975,"ATP Challenger Champaign, USA Men Singles",singles,men,72,3973
3977,"ATP Challenger Champaign, USA Men Doubles",doubles,men,72,3973
3987,"ATP Challenger Helsinki, Finland Men Singles",singles,men,72,3985
3989,"ATP Challenger Helsinki, Finland Men Doubles",doubles,men,72,3985
3993,"ATP Challenger Toyota, Japan Men Singles",singles,men,72,3991
3995,"ATP Challenger Toyota, Japan Men Doubles",doubles,men,72,3991
3999,"ATP Montpellier, France Men Singles",singles,men,3,3997
4001,"ATP Montpellier, France Men Doubles",doubles,men,3,3997
4011,"ATP Challenger Loughborough, Great Britain Men Singles",singles,men,72,4009
4013,"ATP Challenger Loughborough, Great Britain Men Doubles",doubles,men,72,4009
4083,"ATP Challenger Buenos Aires, Argentina Men Singles",singles,men,72,4081
4085,"ATP Challenger Buenos Aires, Argentina Men Doubles",doubles,men,72,4081
4143,Dominican Republic F2 Men Singles,singles,men,785,4141
4145,Dominican Republic F2 Men Doubles,doubles,men,785,4141
4149,"ATP Challenger Santiago, Chile Men Singles",singles,men,72,4147
4151,"ATP Challenger Santiago, Chile Men Doubles",doubles,men,72,4147
4185,"WTA Baku, Azerbaijan Women Singles",singles,women,6,4183
4187,"WTA Baku, Azerbaijan Women Doubles",doubles,women,6,4183
4209,"ATP Challenger Quimper, France Men Singles",singles,men,72,4207
4211,"ATP Challenger Quimper, France Men Doubles",doubles,men,72,4207
4221,"WTA Doha, Qatar Women Singles",singles,women,6,4219
4223,"WTA Doha, Qatar Women Doubles",doubles,women,6,4219
4299,"ATP Challenger Le Gosier, Guadeloupe Men Singles",singles,men,72,4297
4301,"ATP Challenger Le Gosier, Guadeloupe Men Doubles",doubles,men,72,4297
4311,"ATP Challenger Barranquilla, Colombia Men Singles",singles,men,72,4309
4313,"ATP Challenger Barranquilla, Colombia Men Doubles",doubles,men,72,4309
4329,"ATP Winston Salem, USA Men Singles",singles,men,3,4327
4331,"ATP Winston Salem, USA Men Doubles",doubles,men,3,4327
4393,"ITF Men Stuttgart-Stammheim, Germany Men Singles",singles,men,785,4391
4395,"ITF Men Stuttgart-Stammheim, Germany Men Doubles",doubles,men,785,4391
4415,"ITF Women Kaarst, Germany Women Singles",singles,women,213,4413
4417,"ITF Women Kaarst, Germany Women Doubles",doubles,women,213,4413
4489,"WTA Dubai, UAE Women Singles",singles,women,6,4487
4491,"WTA Dubai, UAE Women Doubles",doubles,women,6,4487
4507,"ATP Challenger Bogota, Colombia Men Singles",singles,men,72,4505
4509,"ATP Challenger Bogota, Colombia Men Doubles",doubles,men,72,4505
4531,"WTA Acapulco, Mexico Women Singles",singles,women,6,2707
4533,"WTA Acapulco, Mexico Women Doubles",doubles,women,6,2707
4537,"ATP Challenger Casablanca, Morocco Men Singles",singles,men,72,4535
4539,"ATP Challenger Casablanca, Morocco Men Doubles",doubles,men,72,4535
4559,"WTA Kuala Lumpur, Malaysia Women Singles",singles,women,6,4557
4561,"WTA Kuala Lumpur, Malaysia Women Doubles",doubles,women,6,4557
4577,"ITF Men Cherkassy, Ukraine Men Singles",singles,men,785,4575
4579,"ITF Men Cherkassy, Ukraine Men Doubles",doubles,men,785,4575
4589,"WTA Indian Wells, USA Women Singles",singles,women,6,2737
